{
  "schema_version": "v1",
  "checkpoint_id": "G1E_RF_003_CP1",
  "skill": "CVC Words and Sound Blending",
  "questions": [
    {
      "question_id": "G1E_RF_003_CP1_Q1",
      "prompt": "Read: h-a-t",
      "answer": "hat"
    },
    {
      "question_id": "G1E_RF_003_CP1_Q2",
      "prompt": "Read: p-i-g",
      "answer": "pig"
    },
    {
      "question_id": "G1E_RF_003_CP1_Q3",
      "prompt": "Read: b-u-g",
      "answer": "bug"
    }
  ],
  "pass_threshold": 0.8,
  "feedback_rules": [
    {
      "condition": "score >= pass_threshold",
      "feedback": "Advance to next practice set."
    },
    {
      "condition": "score < pass_threshold",
      "feedback": "Assign mini-reteach and guided practice loop."
    }
  ],
  "pathway_recommendation": {
    "if_pass": "adaptive_practice",
    "if_fail": "lesson_support_loop"
  },
  "source_metadata": {
    "source_phase_folder": "phase-7b",
    "source_file": "Grade 1 English Production Reading Foundations Skill 3 CVC Words + Blending (Early Decoding)"
  }
}
