{
  "schema_version": "v1",
  "checkpoint_id": "G1E_LW_001_CP1",
  "skill": "Sentence Building Capitalization and Punctuation",
  "questions": [
    {
      "question_id": "G1E_LW_001_CP1_Q1",
      "prompt": "Fix: i run",
      "answer": "I run."
    },
    {
      "question_id": "G1E_LW_001_CP1_Q2",
      "prompt": "Does sentence need punctuation?",
      "answer": "yes"
    },
    {
      "question_id": "G1E_LW_001_CP1_Q3",
      "prompt": "Which letter begins sentence?",
      "answer": "capital"
    }
  ],
  "pass_threshold": 0.8,
  "feedback_rules": [
    {
      "condition": "score >= pass_threshold",
      "feedback": "Advance to next practice set."
    },
    {
      "condition": "score < pass_threshold",
      "feedback": "Assign mini-reteach and guided practice loop."
    }
  ],
  "pathway_recommendation": {
    "if_pass": "adaptive_practice",
    "if_fail": "lesson_support_loop"
  },
  "source_metadata": {
    "source_phase_folder": "phase-7b",
    "source_file": "Grade 1 English Production Language + Writing Skill 9 Sentence Building + Capitalization + Punctuation"
  }
}
