{
  "schema_version": "v1",
  "checkpoint_id": "G1E_RF_002_CP1",
  "skill": "Phonemic Awareness and Beginning Sounds",
  "questions": [
    {
      "question_id": "G1E_RF_002_CP1_Q1",
      "prompt": "What beginning sound is in dog?",
      "answer": "/d/"
    },
    {
      "question_id": "G1E_RF_002_CP1_Q2",
      "prompt": "Which word starts with /s/?",
      "answer": "sun"
    },
    {
      "question_id": "G1E_RF_002_CP1_Q3",
      "prompt": "What beginning sound is in map?",
      "answer": "/m/"
    }
  ],
  "pass_threshold": 0.8,
  "feedback_rules": [
    {
      "condition": "score >= pass_threshold",
      "feedback": "Advance to next practice set."
    },
    {
      "condition": "score < pass_threshold",
      "feedback": "Assign mini-reteach and guided practice loop."
    }
  ],
  "pathway_recommendation": {
    "if_pass": "adaptive_practice",
    "if_fail": "lesson_support_loop"
  },
  "source_metadata": {
    "source_phase_folder": "phase-7b",
    "source_file": "Grade 1 English Production Reading Foundations Skill 2 Phonemic Awareness + Beginning Sounds"
  }
}
