{
  "schema_version": "v1",
  "checkpoint_id": "G1E_RF_004_CP1",
  "skill": "Sight Words and High Frequency Words",
  "questions": [
    {
      "question_id": "G1E_RF_004_CP1_Q1",
      "prompt": "Read: is",
      "answer": "is"
    },
    {
      "question_id": "G1E_RF_004_CP1_Q2",
      "prompt": "Read: and",
      "answer": "and"
    },
    {
      "question_id": "G1E_RF_004_CP1_Q3",
      "prompt": "Read: like",
      "answer": "like"
    }
  ],
  "pass_threshold": 0.8,
  "feedback_rules": [
    {
      "condition": "score >= pass_threshold",
      "feedback": "Advance to next practice set."
    },
    {
      "condition": "score < pass_threshold",
      "feedback": "Assign mini-reteach and guided practice loop."
    }
  ],
  "pathway_recommendation": {
    "if_pass": "adaptive_practice",
    "if_fail": "lesson_support_loop"
  },
  "source_metadata": {
    "source_phase_folder": "phase-7b",
    "source_file": "Grade 1 English Production Reading Foundations Skill 4 Sight Words + High Frequency Words"
  }
}
